{
    "listen": ":5202",
    "kcp_connect": "127.0.0.1:5555",
    "kcp": {
        "mtu": 1492,
        "sndwnd": 256,
        "rcvwnd": 256,
        "nodelay": 1,
        "interval": 100,
        "resend": 0,
        "nc": 1
    },
    "udp": {
        "sndbuf": 1048576,
        "rcvbuf": 1048576
    },
    "method": "xchacha20poly1305_ietf",
    "password": "k",
    "loglevel": 6
}